{
  "condition_id": "Q0119",
  "category": "execution_precondition",
  "rationale": "This condition checks whether the mapped procedure can run and record activation in an executable implementation. Satisfying it enables observation without changing the mechanism, inference, or retained target. The parent’s prototype qualification concerns a different evidential setting and does not make this implementation check a target-fidelity condition.",
  "if_execution": {
    "verification_or_satisfaction_method": "Confirm that an executable flow is available and verify that completing the defined activation event produces an observable record."
  },
  "if_validity_relevant": null,
  "uncertainty": []
}