{
  "condition_id": "Q0003",
  "category": "warrant_condition",
  "rationale": "The comparison under comparable demand and staffing and assessment against predefined criteria determine whether pilot outcomes justify attributing improvement to the change. Without this evidential bridge, observed differences could reflect alternative explanations or fail the specified success criteria.",
  "if_execution": null,
  "if_validity_relevant": {
    "affected_link": "signal_inference"
  },
  "uncertainty": []
}