{
  "condition_id": "Q0154",
  "category": "target_fidelity_condition",
  "rationale": "The condition connects justified chronological findings to the retained steering question by requiring competing accounts to differ on event orderings the available series can resolve. Without that difference, alignment could still establish chronology, but would not provide the specified discriminating contribution to assessing steering.",
  "if_execution": null,
  "if_validity_relevant": {
    "affected_link": "inference_target"
  },
  "uncertainty": []
}