{
  "condition_id": "Q0138",
  "category": "warrant_condition",
  "rationale": "Independence prevents trace-derived ledger lines from merely reproducing the sequence hypothesis they are used to support. External dating or attribution and convergence across independent feature classes provide an evidential bridge from ledger continuity to the inferred revision and assembly sequence. Without that independence, the procedure can run, but its signal may offer circular support for the inference.",
  "if_execution": null,
  "if_validity_relevant": {
    "affected_link": "signal_inference"
  },
  "uncertainty": []
}