{
  "condition_id": "Q0162",
  "category": "warrant_condition",
  "rationale": "A check must be capable of detecting the mechanism for a contradicting observation to justify eliminating it. This condition governs the evidential warrant for elimination; without it, the result may reflect an insensitive check rather than evidence against the mechanism.",
  "if_execution": null,
  "if_validity_relevant": {
    "affected_link": "signal_inference"
  },
  "uncertainty": []
}