{
  "condition_id": "Q0044",
  "category": "warrant_condition",
  "rationale": "The condition requires identifiability at the claimed localization resolution. Route diversity or intermediate observations must distinguish handoff contributions; otherwise, localization must remain at the combined-region level. This determines what the observed duration patterns justify inferring, rather than merely whether observations can be collected.",
  "if_execution": null,
  "if_validity_relevant": {
    "affected_link": "signal_inference"
  },
  "uncertainty": []
}