{
  "condition_id": "Q0143",
  "category": "execution_precondition",
  "rationale": "Ticket-history availability enables route reconstruction and duration measurement for the chosen case family and period. Establishing that histories exist does not change the mapped mechanism, evidential warrant, inference or target. Event comparability and timestamp reliability are separate conditions.",
  "if_execution": {
    "verification_or_satisfaction_method": "Check the ticket system or archive for histories covering the chosen case family and period, and inspect a sample to confirm availability."
  },
  "if_validity_relevant": null,
  "uncertainty": []
}